{
  "date": "2024-05-13",
  "title": "OpenAI GPT-4o Released",
  "organization": "OpenAI",
  "level": "major",
  "tags": [
    "openai",
    "model-release",
    "gpt",
    "multimodal",
    "llm"
  ],
  "description": "OpenAI released GPT-4o ('o' for omni), their flagship model with native multimodal capabilities across text, audio, and vision. It featured response times as fast as humans (232ms average for audio), 50+ language support, and was made available to free ChatGPT users.",
  "highlights": [
    "Native multimodal (text, audio, vision)",
    "232ms average audio response time",
    "50+ language support",
    "Free tier availability",
    "Improved vision and non-English performance"
  ],
  "sources": [
    {
      "title": "GPT-4o Announcement",
      "url": "https://openai.com/index/hello-gpt-4o/"
    }
  ]
}
