{
  "date": "2023-12-11",
  "title": "Mixtral 8x7B Released",
  "organization": "Mistral AI",
  "level": "major",
  "tags": ["mistral", "model-release", "open-source", "mixture-of-experts", "mixtral"],
  "description": "Mistral AI released Mixtral 8x7B, a sparse Mixture of Experts (MoE) model that outperformed GPT-3.5 and Llama 2 70B on most benchmarks. With only 12.9B active parameters per token from 46.7B total, it delivered exceptional efficiency. The model matched or exceeded GPT-3.5 Turbo on standard benchmarks while being faster and cheaper to run.",
  "highlights": [
    "Sparse Mixture of Experts (MoE) architecture",
    "Outperformed GPT-3.5 on most benchmarks",
    "Only 12.9B active parameters per token",
    "Apache 2.0 open-source license",
    "Efficient inference with high performance"
  ],
  "sources": [
    {
      "title": "Mixtral 8x7B Release Announcement",
      "url": "https://mistral.ai/news/mixtral-of-experts/"
    }
  ]
}
