{
  "date": "2025-01-31",
  "title": "OpenAI o3-mini Released",
  "organization": "OpenAI",
  "level": "major",
  "tags": [
    "openai",
    "model-release",
    "o3",
    "reasoning",
    "llm"
  ],
  "description": "OpenAI released o3-mini, a cost-efficient reasoning model optimized for coding, math, and science. It offered adjustable reasoning effort levels and was made available to free ChatGPT users, democratizing access to reasoning capabilities while maintaining strong performance.",
  "highlights": [
    "Cost-efficient reasoning model",
    "Adjustable reasoning effort",
    "Free tier availability",
    "Optimized for STEM tasks",
    "Lower latency than o1"
  ],
  "sources": [
    {
      "title": "OpenAI o3-mini",
      "url": "https://openai.com/index/openai-o3-mini/"
    }
  ]
}
