{
  "date": "2025-01-13",
  "title": "Kimi k1.5: Scaling Reinforcement Learning with LLMs",
  "organization": "Moonshot AI",
  "level": "major",
  "tags": [
    "model-release",
    "reasoning",
    "reinforcement-learning",
    "kimi"
  ],
  "description": "Moonshot AI released Kimi k1.5, demonstrating that reinforcement learning with long chain-of-thought reasoning can achieve state-of-the-art performance on complex tasks. The model showed strong reasoning capabilities through extensive RL training, achieving competitive results against top models on math, coding, and reasoning benchmarks without relying on massive supervised datasets.",
  "highlights": [
    "Long chain-of-thought reasoning",
    "Extensive reinforcement learning",
    "Strong math and coding performance",
    "Competitive with top models",
    "Minimal supervised data needed"
  ],
  "sources": [
    {
      "title": "Kimi k1.5 Technical Report",
      "url": "https://arxiv.org/abs/2501.12599"
    }
  ]
}
