{
  "date": "2025-08-07",
  "title": "GPT-5 Released",
  "organization": "OpenAI",
  "level": "major",
  "tags": [
    "openai",
    "model-release",
    "gpt",
    "llm",
    "multimodal"
  ],
  "description": "OpenAI released GPT-5, its smartest and most useful model yet with built-in thinking. The launch emphasized stronger coding, reasoning, writing, health, and multimodal performance, plus a unified system that decides when to answer quickly or think longer.",
  "highlights": [
    "Unified system with built-in thinking",
    "Stronger coding and reasoning performance",
    "Improved writing and health use cases",
    "Multimodal support across common tasks",
    "Available to all users with tiered access"
  ],
  "sources": [
    {
      "title": "Introducing GPT-5",
      "url": "https://openai.com/index/introducing-gpt-5"
    }
  ]
}
