{
  "date": "2024-03-12",
  "title": "Devin: AI Software Engineer",
  "organization": "Cognition Labs",
  "level": "major",
  "tags": [
    "cognition",
    "product-launch",
    "devin",
    "coding",
    "agent"
  ],
  "description": "Cognition Labs introduced Devin, billed as the first fully autonomous AI software engineer. Devin can plan and execute complex engineering tasks, learning from its mistakes and working on projects end-to-end including coding, debugging, and deployment.",
  "highlights": [
    "First autonomous AI software engineer",
    "End-to-end project execution",
    "Self-correcting and learning",
    "Plans and executes complex tasks",
    "13.86% on SWE-bench (state-of-the-art)"
  ],
  "sources": [
    {
      "title": "Devin Introduction",
      "url": "https://www.cognition.ai/blog/introducing-devin"
    }
  ]
}
