{
  "date": "2024-09-25",
  "title": "Llama 3.2 Released",
  "organization": "Meta AI",
  "level": "major",
  "tags": [
    "meta-ai",
    "model-release",
    "open-source",
    "llama",
    "llm",
    "vision",
    "multimodal"
  ],
  "description": "Meta released Llama 3.2, introducing vision-capable open models for the first time. The release included lightweight 1B and 3B text-only models optimized for edge devices, plus 11B and 90B multimodal models with vision understanding. These were the first open-source models to natively integrate vision and language capabilities, enabling on-device AI applications while maintaining competitive performance.",
  "highlights": [
    "First open-source vision-language models",
    "1B and 3B models for edge devices",
    "11B and 90B multimodal variants",
    "On-device AI capabilities",
    "Fully open-source"
  ],
  "sources": [
    {
      "title": "Llama 3.2: Revolutionizing Edge AI and Vision",
      "url": "https://ai.meta.com/blog/llama-3-2-connect-2024-vision-edge-mobile-devices/"
    }
  ]
}
